text,Name,Number
A strange seed was planted on its back at birth. The plant sprouts and grows with this POKéMON.,Bulbasaur,#001
Its short feet are tipped with suction pads that enable it to tirelessly climb slopes and walls.,Caterpie,#010
A brutal POKéMON with pressurized water jets on its shell. They are used for high speed tackles.,Blastoise,#009
"Often hides in water to stalk unwary prey. For swimming fast, it moves its ears to maintain balance.",Wartortle,#008
"After birth, its back swells and hardens into a shell. Powerfully sprays foam from its mouth.",Squirtle,#007
Spits fire that is hot enough to melt boulders. Known to cause forest fires unintentionally.,Charizard,#006
"When it swings its burning tail, it elevates the temperature to unbearably high levels.",Charmeleon,#005
"Obviously prefers hot places. When it rains, steam is said to spout from the tip of its tail.",Charmander,#004
The plant blooms when it is absorbing solar energy. It stays on the move to seek sunlight.,Venusaur,#003
"When the bulb on its back grows large, it appears to lose the ability to stand on its hind legs.",Ivysaur,#002
"Very protective of its sprawling territorial area, this POKéMON will fiercely peck at any intruder.",Pidgeotto,#017
"When hunting, it skims the surface of water at high speed to pick off unwary prey such as MAGIKARP.",Pidgeot,#018
A common sight in forests and woods. It flaps its wings at ground level to kick up blinding sand.,Pidgey,#016
Flies at high speed and attacks using its large venomous stingers on its forelegs and tail.,Beedrill,#015
"Almost incapable of moving, this POKéMON can only harden its shell to protect itself from predators.",Kakuna,#014
"Often found in forests, eating leaves. It has a sharp venomous stinger on its head.",Weedle,#013
"Able to conceal itself in shadows, it never appears before humans, so its very existence was the stuff of myth.",Marshadow,#802
"This artificial Pokémon, constructed more than 500 years ago, can understand human speech but cannot itself speak.",Magearna,#801
"Reminiscent of the Ultra Beasts, this life-form, apparently asleep underground, is thought to have come from another world in ancient times.",Necrozma,#800
"It has gobbled mountains and swallowed whole buildings, according to reports. It’s one of the Ultra Beasts.",Guzzlord,#799
"This Ultra Beast came from the Ultra Wormhole. It seems not to attack enemies on its own, but its sharp body is a dangerous weapon in itself.",Kartana,#798
It appeared from the Ultra Wormhole. Witnesses observed it flying across the sky at high speed.,Celesteela,#797
"One of the mysterious life-forms known as Ultra Beasts. Astonishing electric shocks emanate from its entire body, according to witnesses.",Xurkitree,#796
"One of the dangerous Ultra Beasts, it has been spotted running across the land at terrific speeds.",Pheromosa,#795
"This Ultra Beast appeared from another world. It shows off its body, but whether that display is a boast or a threat remains unclear.",Buzzwole,#794
One of several mysterious Ultra Beasts. People on the street report observing those infested by it suddenly becoming violent.,Nihilego,#793
"It is said to be a female evolution of Cosmog. When its third eye activates, away it flies to another world.",Lunala,#792
It is said to live in another world. The intense light it radiates from the surface of its body can make the darkest of nights light up like midday.,Solgaleo,#791
"Motionless as if dead, its body is faintly warm to the touch. In the distant past, it was called the cocoon of the stars.",Cosmoem,#790
Its body is gaseous and frail. It slowly grows as it collects dust from the atmosphere.,Cosmog,#789
The dense fog it creates brings the downfall and destruction of its confused enemies. Ocean currents are the source of its energy.,Tapu Fini,#788
"It pulls large trees up by the roots and swings them around. It causes vegetation to grow, and then it absorbs energy from the growth.",Tapu Bulu,#787
This guardian deity of Akala is guilelessly cruel. The fragrant aroma of flowers is the source of its energy.,Tapu Lele,#786
This guardian deity of Melemele is brimming with curiosity. It summons thunderclouds and stores their lightning inside its body.,Tapu Koko,#785
"When it spots enemies, it threatens them by jingling the scales on its tail. Weak opponents will crack and flee in panic.",Kommo-o,#784
It leaps at its prey with a courageous shout. Its scaly punches tear its opponents to shreds.,Hakamo-o,#783
It expresses its feelings by smacking its scales. Metallic sounds echo through the tall mountains where Jangmo-o lives.,Jangmo-o,#782
"Swinging its massive anchor, it can KO Wailord in a single blow. What appears to be green seaweed is actually its body.",Dhelmise,#781
"It has a compassionate personality, but if it is angered, it completely destroys its surroundings with its intense breath.",Drampa,#780
"When it unleashes its psychic power from the protuberance on its head, the grating sound of grinding teeth echoes through the area.",Bruxish,#779
Its actual appearance is unknown. A scholar who saw what was under its rag was overwhelmed by terror and died from the shock.,Mimikyu,#778
"The spiny fur on its back is normally at rest. When this Pokémon becomes agitated, its fur stands on end and stabs into its attackers.",Togedemaru,#777
The shell on its back is chemically unstable and explodes violently if struck. The hole in its stomach is its weak point.,Turtonator,#776
"It is born asleep, and it dies asleep. All its movements are apparently no more than the results of it tossing and turning in its dreams.",Komala,#775
"Originally making its home in the ozone layer, it hurtles to the ground when the shell enclosing its body grows too heavy.",Minior,#774
"Its trust in its partner is what awakens it. This Pokémon is capable of changing its type, a flexibility that is well displayed in battle.",Silvally,#773
The heavy control mask it wears suppresses its intrinsic capabilities. This Pokémon has some hidden special power.,Type: Null,#772
"It lives in shallow seas, such as areas near a beach. It can eject its internal organs, which it uses to engulf its prey or battle enemies.",Pyukumuku,#771
"Possessed people controlled by this Pokémon transformed its sand mound into a castle. As it evolved, its power to curse grew ever stronger.",Palossand,#770
"Born from a sand mound playfully built by a child, this Pokémon embodies the grudges of the departed.",Sandygast,#769
"With a flashing slash of its giant sharp claws, it cleaves seawater—or even air—right in two.",Golisopod,#768
"This Pokémon is a coward. As it desperately dashes off, the flailing of its many legs leaves a sparkling clean path in its wake.",Wimpod,#767
They form groups of roughly 20 individuals. Their mutual bond is remarkable—they will never let down a comrade.,Passimian,#766
"Known for its extreme intelligence, this Pokémon will look down on inexperienced Trainers, so it’s best suited to veteran Trainers.",Oranguru,#765
"It attaches flowers to its highly nutritious vine. This revitalizes the flowers, and they give off an aromatic scent.",Comfey,#764
"Its long, striking legs aren’t just for show but to be used to kick with skill. In victory, it shows off by kicking the defeated, laughing boisterously.",Tsareena,#763
"The sepals on its head developed to protect its body. These are quite hard, so even if pecked by bird Pokémon, this Pokémon is totally fine.",Steenee,#762
A delectable aroma pours from its body. They are often swallowed whole by Toucannon lured by that wafting deliciousness.,Bounsweet,#761
This immensely dangerous Pokémon possesses overwhelming physical strength. Its habitat is generally off-limits.,Bewear,#760
"Despite its adorable appearance, when it gets angry and flails about, its arms and legs could knock a pro wrestler sprawling.",Stufful,#759
"For some reason, only females have been found. It creates a reverse harem of male Salandit that it lives with.",Salazzle,#758
"It burns its bodily fluids to create a poisonous gas. When its enemies become disoriented from inhaling the gas, it attacks them.",Salandit,#757
Forests where Shiinotic live are treacherous to enter at night. People confused by its strange lights can never find their way home again.,Shiinotic,#756
It scatters spores that flicker and glow. Anyone seeing these lights falls into a deep slumber.,Morelull,#755
"It requires a lot of effort to maintain Lurantis’s vivid coloring, but some collectors enjoy this work and treat it as their hobby.",Lurantis,#754
"During the day, it sleeps and soaks up light. When night falls, it walks around looking for a safer place to sleep.",Fomantis,#753
"It delivers headbutts with the water bubble on its head. Small Pokémon get sucked into the bubble, where they drown.",Araquanid,#752
It crawls onto the land in search of food. Its water bubble allows it to breathe and protects its soft head.,Dewpider,#751
"It spits a mud that provides resistance to both wind and rain, so the walls of old houses were often coated with it.",Mudsdale,#750
The mud stuck to Mudbray’s hooves enhances its grip and its powerful running gait.,Mudbray,#749
Toxapex crawls along the ocean floor on its 12 legs. It leaves a trail of Corsola bits scattered in its wake.,Toxapex,#748
"It plunges the poison spike on its head into its prey. When the prey has weakened, Mareanie deals the finishing blow with its 10 tentacles.",Mareanie,#747
"When it’s in trouble, its eyes moisten and begin to shine. The shining light attracts its comrades, and they stand together against their enemies.",Wishiwashi,#746
"Its quick movements confuse its enemies. Well equipped with claws and fangs, it also uses the sharp rocks in its mane as weapons.",Lycanroc,#745
"It’s considered to be a good Pokémon for beginners because of its friendliness, but its disposition grows rougher as it grows up.",Rockruff,#744
"It rolls up pollen into puffs. It makes many different varieties, some used as food and others used in battle.",Ribombee,#743
"It feeds on the nectar and pollen of flowers. Because it’s able to sense auras, it can identify which flowers are about to bloom.",Cutiefly,#742
"It beats its wings together to create fire. As it moves in the steps of its beautiful dance, it bathes opponents in intense flames.",Oricorio,#741
"It aimed for the top but got lost and ended up on a snowy mountain. Being forced to endure the cold, this Pokémon evolved and grew fur.",Crabominable,#740
"It zips around, on sharp lookout for an opening. It concentrates electrical energy within its large jaws and uses it to zap its enemies.",Vikavolt,#738
"While guarding its weak points with its pincers, it looks for an opening and unleashes punches. When it loses, it foams at the mouth and faints.",Crabrawler,#739
"Its body is capable of storing electricity. On camping trips, people are grateful to have one around.",Charjabug,#737
Its strong jaw enables it to scrape trees and slurp out the sap. It normally lives underground.,Grubbin,#736
"When it finds a trace of its prey, it patiently stakes out the location...but it’s always snoozing by nightfall.",Gumshoos,#735
"With its sharp fangs, it will bite anything. It did not originally live in Alola but was imported from another region.",Yungoos,#734
"When it battles, its beak heats up. The temperature can easily exceed 212 degrees Fahrenheit, causing severe burns when it hits.",Toucannon,#733
"It eats berries and stores their seeds in its beak. When it encounters enemies or prey, it fires off all the seeds in a burst.",Trumbeak,#732
It can peck at a rate of 16 times a second to drill holes in trees. It uses the holes for food storage and for nesting.,Pikipek,#731
It controls its water balloons with song. The melody is learned from others of its kind and is passed down from one generation to the next.,Primarina,#730
"A skillful dancer, it creates a sequence of water balloons as it dances, and briskly bombards its enemies.",Brionne,#729
"This Pokémon snorts body fluids from its nose, blowing balloons to smash into its foes. It’s famous for being a hard worker.",Popplio,#728
"This Pokémon has a violent, selfish disposition. If it’s not in the mood to listen, it will ignore its Trainer’s orders with complete nonchalance.",Incineroar,#727
"At its throat, it bears a bell of fire. The bell rings brightly whenever this Pokémon spits fire.",Torracat,#726
"While grooming itself, it builds up fur inside its stomach. It sets the fur alight and spews fiery attacks, which change based on how it coughs.",Litten,#725
"It fires arrow quills from its wings with such precision, they can pierce a pebble at distances over a hundred yards.",Decidueye,#724
"A bit of a dandy, it spends its free time preening its wings. Its preoccupation with any dirt on its plumage can leave it unable to battle.",Dartrix,#723
"This wary Pokémon uses photosynthesis to store up energy during the day, while becoming active at night.",Rowlet,#722
It lets out billows of steam and disappears into the dense fog. It’s said to live in mountains where humans do not tread.,Volcanion,#721
"This troublemaker sends anything and everything to faraway places using its loop, which can warp space.",Hoopa,#720
"A sudden transformation of Carbink, its pink, glimmering body is said to be the loveliest sight in the whole world.",Diancie,#719
"When the Kalos region’s ecosystem falls into disarray, it appears and reveals its secret power.",Zygarde,#718
"When this legendary Pokémon’s wings and tail feathers spread wide and glow red, it absorbs the life force of living creatures.",Yveltal,#717
Legends say it can share eternal life. It slept for a thousand years in the form of a tree before its revival.,Xerneas,#716
They fly around on moonless nights and attack careless prey. Nothing can beat them in a battle in the dark.,Noivern,#715
"They live in pitch-black caves. Their enormous ears can emit ultrasonic waves of 200,000 hertz.",Noibat,#714
Its ice-covered body is as hard as steel. Its cumbersome frame crushes anything that stands in its way.,Avalugg,#713
It blocks opponents’ attacks with the ice that shields its body. It uses cold air to repair any cracks with new ice.,Bergmite,#712
"Singing in eerie voices, they wander town streets on the night of the new moon. Anyone who hears their song is cursed.",Gourgeist,#711
"The pumpkin body is inhabited by a spirit trapped in this world. As the sun sets, it becomes restless and active.",Pumpkaboo,#710
"It can control trees at will. It will trap people who harm the forest, so they can never leave.",Trevenant,#709
These Pokémon are created when spirits possess rotten tree stumps. They prefer to live in abandoned forests.,Phantump,#708
These key collectors threaten any attackers by fiercely jingling their keys at them.,Klefki,#707
"This very friendly Dragon-type Pokémon will hug its beloved Trainer, leaving that Trainer covered in sticky slime.",Goodra,#706
"It drives away opponents by excreting a sticky liquid that can dissolve anything. Its eyes devolved, so it can’t see anything.",Sliggoo,#705
"The weakest Dragon-type Pokémon, it lives in damp, shady places, so its body doesn’t dry out.",Goomy,#704
"Born from the temperatures and pressures deep underground, it fires beams from the stone in its head.",Carbink,#703
"Its whiskers serve as antennas. By sending and receiving electrical waves, it can communicate with others over vast distances.",Dedenne,#702
"Although its body is small, its proficient fighting skills enable it to keep up with big bruisers like Machamp and Hariyama.",Hawlucha,#701
It sends a soothing aura from its ribbonlike feelers to calm fights.,Sylveon,#700
"The diamond-shaped crystals on its body expel air as cold as -240 degrees Fahrenheit, surrounding its enemies and encasing them in ice.",Aurorus,#699
This ancient Pokémon was restored from part of its body that had been frozen in ice for over 100 million years.,Amaura,#698
"Thanks to its gargantuan jaws, which could shred thick metal plates as if they were paper, it was invincible in the ancient world it once inhabited.",Tyrantrum,#697
"This Pokémon was restored from a fossil. If something happens that it doesn’t like, it throws a tantrum and runs wild.",Tyrunt,#696
"They make their home in deserts. They can generate their energy from basking in the sun, so eating food is not a requirement.",Helioptile,#694
They flare their frills and generate energy. A single Heliolisk can generate sufficient electricity to power a skyscraper.,Heliolisk,#695
They knock down flying prey by firing compressed water from their massive claws like shooting a pistol.,Clauncher,#692
Their enormous claws launch cannonballs of water powerful enough to pierce tanker hulls.,Clawitzer,#693
"Their poison is strong enough to eat through the hull of a tanker, and they spit it indiscriminately at anything that enters their territory.",Dragalge,#691
"Camouflaged as rotten kelp, they spray liquid poison on prey that approaches unawares and then finish it off.",Skrelp,#690
"When they evolve, two Binacle multiply into seven. They fight with the power of seven Binacle.",Barbaracle,#689
"Two Binacle live together on one rock. When they fight, one of them will move to a different rock.",Binacle,#688
"It wields the most compelling hypnotic powers of any Pokémon, and it forces others to do whatever it wants.",Malamar,#687
Opponents who stare at the flashing of the light-emitting spots on its body become dazed and lose their will to fight.,Inkay,#686
It can distinguish the faintest of scents. It puts its sensitive sense of smell to use by helping pastry chefs in their work.,Slurpuff,#685
"To entangle its opponents in battle, it extrudes white threads as sweet and sticky as cotton candy.",Swirlix,#684
"It devises various scents, pleasant and unpleasant, and emits scents that its enemies dislike in order to gain an edge in battle.",Aromatisse,#683
"Generations of kings were attended by these Pokémon, which used their spectral power to manipulate and control people and Pokémon.",Aegislash,#681
It emits a scent that enraptures those who smell it. This fragrance changes depending on what it has eaten.,Spritzee,#682
"When Honedge evolves, it divides into two swords, which cooperate via telepathy to coordinate attacks and slash their enemies to ribbons.",Doublade,#680
Apparently this Pokémon is born when a departed spirit inhabits a sword. It attaches itself to people and drinks their life force.,Honedge,#679
"When in danger, it raises its ears and releases enough psychic power to grind a 10-ton truck into dust.",Meowstic,#678
The organ that emits its intense psychic power is sheltered by its ears to keep power from leaking out.,Espurr,#677
Trimming its fluffy fur not only makes it more elegant but also increases the swiftness of its movements.,Furfrou,#676
"Although it possesses a violent temperament, it won’t put up with bullying. It uses the leaf in its mouth to sense the movements of its enemies.",Pangoro,#675
"It does its best to be taken seriously by its enemies, but its glare is not sufficiently intimidating. Chewing on a leaf is its trademark.",Pancham,#674
It can tell how its Trainer is feeling by subtle shifts in the grip on its horns. This empathic sense lets them run as if one being.,Gogoat,#673
"Thought to be one of the first Pokémon to live in harmony with humans, it has a placid disposition.",Skiddo,#672
"It claims exquisite flower gardens as its territory, and it obtains power from basking in the energy emitted by flowering plants.",Florges,#671
It flutters around fields of flowers and cares for flowers that are starting to wilt. It draws out the hidden power of flowers to battle.,Floette,#670
It draws out and controls the hidden power of flowers. The flower Flabébé holds is most likely part of its body.,Flabébé,#669
The male with the largest mane of fire is the leader of the pride.,Pyroar,#668
"The stronger the opponent it faces, the more heat surges from its mane and the more power flows through its body.",Litleo,#667
Vivillon with many different patterns are found all over the world. These patterns are affected by the climate of their habitat.,Vivillon,#666
"It lives hidden within thicket shadows. When predators attack, it quickly bristles the fur covering its body in an effort to threaten them.",Spewpa,#665
"When under attack from bird Pokémon, it spews a poisonous black powder that causes paralysis on contact.",Scatterbug,#664
"In the fever of an exciting battle, it showers embers from the gaps between its feathers and takes to the air.",Talonflame,#663
"From its beak, it expels embers that set the tall grass on fire. Then it pounces on the bewildered prey that pop out of the grass.",Fletchinder,#662
These friendly Pokémon send signals to one another with beautiful chirps and tail-feather movements.,Fletchling,#661
"With their powerful ears, they can heft boulders of a ton or more with ease. They can be a big help at construction sites.",Diggersby,#660
They use their large ears to dig burrows. They will dig the whole night through.,Bunnelby,#659
"It creates throwing stars out of compressed water. When it spins them and throws them at high speed, these stars can split metal in two.",Greninja,#658
"It can throw bubble-covered pebbles with precise control, hitting empty cans up to a hundred feet away.",Frogadier,#657
It secretes flexible bubbles from its chest and back. The bubbles reduce the damage it would otherwise take when attacked.,Froakie,#656
"It gazes into the flame at the tip of its branch to achieve a focused state, which allows it to see into the future.",Delphox,#655
"It has a twig stuck in its tail. With friction from its tail fur, it sets the twig on fire and launches into battle.",Braixen,#654
"Eating a twig fills it with energy, and its roomy ears give vent to air hotter than 390 degrees Fahrenheit.",Fennekin,#653
Its Tackle is forceful enough to flip a 50-ton tank. It shields its allies from danger with its own body.,Chesnaught,#652
It relies on its sturdy shell to deflect predators’ attacks. It counterattacks with its sharp quills.,Quilladin,#651
"The quills on its head are usually soft. When it flexes them, the points become so hard and sharp that they can pierce rock.",Chespin,#650
"Over 300 million years ago, it was feared as the strongest of hunters. It has been modified by Team Plasma.",Genesect,#649
Its melodies are sung with a special vocalization method that can control the feelings of those who hear it.,Meloetta,#648
"By blasting water from its hooves, it can glide across water. It excels at using leg moves while battling.",Keldeo,#647
"It generates a powerful, freezing energy inside itself, but its body became frozen when the energy leaked out.",Kyurem,#646
"The energy that comes pouring from its tail increases the nutrition in the soil, making crops grow to great size.",Landorus,#645
"Concealing itself in lightning clouds, it flies throughout the Unova region. It creates electricity in its tail.",Zekrom,#644
"This Pokémon appears in legends. It sends flames into the air from its tail, burning up everything around it.",Reshiram,#643
Countless charred remains mar the landscape of places through which Thundurus has passed.,Thundurus,#642
The lower half of its body is wrapped in a cloud of energy. It zooms through the sky at 200 mph.,Tornadus,#641
This Pokémon fought humans in order to protect its friends. Legends about it continue to be passed down.,Virizion,#640
This Pokémon came to the defense of Pokémon that had lost their homes in a war among humans.,Terrakion,#639
This legendary Pokémon battled against humans to protect Pokémon. Its personality is calm and composed.,Cobalion,#638
"When volcanic ash darkened the atmosphere, it is said that Volcarona’s fire provided a replacement for the sun.",Volcarona,#637
"This Pokémon was believed to have been born from the sun. When it evolves, its entire body is engulfed in flames.",Larvesta,#636
"This brutal Pokémon travels the skies on its six wings. Anything that moves seems like a foe to it, triggering its attack.",Hydreigon,#635
"After it has eaten up all the food in its territory, it moves to another area. Its two heads do not get along.",Zweilous,#634
"It tends to bite everything, and it is not a picky eater. Approaching it carelessly is dangerous.",Deino,#633
"They attack in groups, covering themselves in steel armor to protect themselves from Heatmor.",Durant,#632
It breathes through a hole in its tail while it burns with an internal fire. Durant is its prey.,Heatmor,#631
It makes a nest out of bones it finds. It grabs weakened prey in its talons and hauls it to its nest of bones.,Mandibuzz,#630
"Its wings are too tiny to allow it to fly. As the time approaches for it to evolve, it discards the bones it was wearing.",Vullaby,#629
They fight for their friends without any thought about danger to themselves. One can carry a car while flying.,Braviary,#628
"They crush berries with their talons. They bravely stand up to any opponent, no matter how strong it is.",Rufflet,#627
"Their fluffy fur absorbs damage, even if they strike foes with a fierce headbutt.",Bouffalant,#626
"It leads a group of Pawniard. It battles to become the boss, but will be driven from the group if it loses.",Bisharp,#625
"Blades comprise this Pokémon’s entire body. If battling dulls the blades, it sharpens them on stones by the river.",Pawniard,#624
It flies across the sky at Mach speeds. Removing the seal on its chest makes its internal energy go out of control.,Golurk,#623
"The energy that burns inside it enables it to move, but no one has yet been able to identify this energy.",Golett,#622
