text,Name,Number
"It warms its body by absorbing sunlight with its wings. When its body temperature falls, it can no longer move.",Druddigon,#621
It wields the fur on its arms like a whip. Its arm attacks come with such rapidity that they cannot even be seen.,Mienshao,#620
"In fights, they dominate with onslaughts of flowing, continuous attacks. With their sharp claws, they cut enemies.",Mienfoo,#619
"Its skin is very hard, so it is unhurt even if stepped on by sumo wrestlers. It smiles when transmitting electricity.",Stunfisk,#618
"When its body dries out, it weakens. So, to prevent dehydration, it wraps itself in many layers of thin membrane.",Accelgor,#617
"When attacked, it defends itself by closing the lid of its shell. It can spit a sticky, poisonous liquid.",Shelmet,#616
"When its body temperature goes up, it turns into steam and vanishes. When its temperature lowers, it returns to ice.",Cryogonal,#615
"It can make its breath freeze at will. Very able in the water, it swims around in northern seas and catches prey.",Beartic,#614
"When it is not feeling well, its mucus gets watery and the power of its Ice-type moves decreases.",Cubchoo,#613
They are kind but can be relentless when defending territory. They challenge foes with tusks that can cut steel.,Haxorus,#612
"Since a broken tusk will not grow back, they diligently sharpen their tusks on river rocks after they’ve been fighting.",Fraxure,#611
They use their tusks to crush the berries they eat. Repeated regrowth makes their tusks strong and sharp.,Axew,#610
"It absorbs a spirit, which it then burns. By waving the flames on its arms, it puts its foes into a hypnotic trance.",Chandelure,#609
"This ominous Pokémon is feared. Through cities it wanders, searching for the spirits of the fallen.",Lampent,#608
"Litwick shines a light that absorbs the life energy of people and Pokémon, which becomes the fuel that it burns.",Litwick,#607
"It can manipulate an opponent’s memory. Apparently, it communicates by flashing its three different-colored fingers.",Beheeyem,#606
"It uses its strong psychic power to squeeze its opponent’s brain, causing unendurable headaches.",Elgyem,#605
They crawl out of the ocean using their arms. They will attack prey on shore and immediately drag it into the ocean.,Eelektross,#604
They coil around foes and shock them with electricity-generating organs that seem simply to be circular patterns.,Eelektrik,#603
"While one alone doesn’t have much power, a chain of many Tynamo can be as powerful as lightning.",Tynamo,#602
Its red core functions as an energy tank. It fires the charged energy through its spikes into an area.,Klinklang,#601
"By changing the direction in which it rotates, it communicates its feelings to others. When angry, it rotates faster.",Klang,#600
The two minigears that mesh together are predetermined. Each will rebound from other minigears without meshing.,Klink,#599
It fights by swinging around its three spiky feelers. A hit from these steel spikes can reduce a boulder to rubble.,Ferrothorn,#598
"When threatened, it attacks by shooting a barrage of spikes, which gives it a chance to escape by rolling away.",Ferroseed,#597
"When attacked, they create an electric barrier by spitting out many electrically charged threads.",Galvantula,#596
Joltik that live in cities have learned a technique for sucking electricity from the outlets in houses.,Joltik,#595
The special membrane enveloping Alomomola has the ability to heal wounds.,Alomomola,#594
"The fate of the ships and crew that wander into Jellicent’s habitat: all sunken, all lost, all vanished.",Jellicent,#593
"With its thin, veil-like arms wrapped around the body of its opponent, it sinks to the ocean floor.",Frillish,#592
"It lures prey close by dancing and waving its arm caps, which resemble Poké Balls, in a swaying motion.",Amoonguss,#591
"It lures people in with its Poké Ball pattern, then releases poison spores. Why it resembles a Poké Ball is unknown.",Foongus,#590
"They fly around at high speed, striking with their pointed spears. Even when in trouble, they face opponents bravely.",Escavalier,#589
These mysterious Pokémon evolve when they receive electrical stimulation while they are in the same place as Shelmet.,Karrablast,#588
The energy made in its cheeks’ electric pouches is stored inside its membrane and released while it is gliding.,Emolga,#587
They migrate according to the seasons. People can tell the season by looking at Sawsbuck’s horns.,Sawsbuck,#586
"The color and scent of their fur changes to match the mountain grass. When they sense hostility, they hide in the grass.",Deerling,#585
"Swallowing large amounts of water, they make snow clouds inside their bodies and attack their foes with violent blizzards.",Vanilluxe,#584
"Snowy mountains are this Pokémon’s habitat. During an ancient ice age, they moved to southern areas.",Vanillish,#583
The temperature of their breath is -58° F. They create snow crystals and make snow fall in the areas around them.,Vanillite,#582
Swanna start to dance at dusk. The one dancing in the middle is the leader of the flock.,Swanna,#581
These bird Pokémon are excellent divers. They swim around in the water eating their favorite food--peat moss.,Ducklett,#580
"When Reuniclus shake hands, a network forms between their brains, increasing their psychic power.",Reuniclus,#579
"Since they have two divided brains, at times they suddenly try to take two different actions at once.",Duosion,#578
They drive away attackers by unleashing psychic power. They can use telepathy to talk with others.,Solosis,#577
Starry skies thousands of light-years away are visible in the space distorted by their intense psychic power.,Gothitelle,#576
They use hypnosis to control people and Pokémon. Tales of Gothorita leading people astray are told in every corner.,Gothorita,#575
Their ribbonlike feelers increase their psychic power. They are always staring at something.,Gothita,#574
Their white fur is coated in a special oil that makes it easy for them to deflect attacks.,Cinccino,#573
"They greet one another by rubbing each other with their tails, which are always kept well groomed and clean.",Minccino,#572
Bonds between these Pokémon are very strong. It protects the safety of its pack by tricking its opponents.,Zoroark,#571
"It changes into the forms of others to surprise them. Apparently, it often transforms into a silent child.",Zorua,#570
It clenches opponents with its left arm and finishes them off with foul-smelling poison gas belched from its mouth.,Garbodor,#569
Inhaling the gas they belch will make you sleep for a week. They prefer unsanitary places.,Trubbish,#568
"They are intelligent and will cooperate to catch prey. From the ground, they use a running start to take flight.",Archeops,#567
"Said to be an ancestor of bird Pokémon, they were unable to fly and moved about by hopping from one branch to another.",Archen,#566
They can live both in the ocean and on land. A slap from one of them is enough to open a hole in the bottom of a tanker.,Carracosta,#565
"Restored from a fossil, this Pokémon can dive to depths beyond half a mile.",Tirtouga,#564
It has been said that they swallow those who get too close and turn them into mummies. They like to eat gold nuggets.,Cofagrigus,#563
Each of them carries a mask that used to be its face when it was human. Sometimes they look at it and cry.,Yamask,#562
"They never vary the route they fly, because their memories of guarding an ancient city remain steadfast.",Sigilyph,#561
Groups of them beat up anything that enters their territory. Each can spit acidic liquid from its mouth.,Scrafty,#560
"Its skin has a rubbery elasticity, so it can reduce damage by defensively pulling its skin up to its neck.",Scraggy,#559
"Competing for territory, Crustle fight viciously. The one whose boulder is broken is the loser of the battle.",Crustle,#558
This Pokémon can easily melt holes in hard rocks with a liquid secreted from its mouth.,Dwebble,#557
It uses an up-tempo song and dance to drive away the bird Pokémon that prey on its flower seeds.,Maractus,#556
"Its internal fire burns at 2,500° F, making enough power that it can destroy a dump truck with one punch.",Darmanitan,#555
"When its internal fire is burning, it cannot calm down and it runs around. When the fire diminishes, it falls asleep.",Darumaka,#554
"They never allow prey to escape. Their jaws are so powerful, they can crush the body of an automobile.",Krookodile,#553
They live in groups of a few individuals. Protective membranes shield their eyes from sandstorms.,Krokorok,#552
They live buried in the sands of the desert. The sun-warmed sands prevent their body temperature from dropping.,Sandile,#551
"Red and blue Basculin get along so poorly, they’ll start fighting instantly. These Pokémon are very hostile.",Basculin,#550
Even veteran Trainers face a challenge in getting its beautiful flower to bloom. This Pokémon is popular with celebrities.,Lilligant,#549
The leaves on its head are very bitter. Eating one of these leaves is known to refresh a tired body.,Petilil,#548
"Like the wind, it can slip through any gap, no matter how small. It leaves balls of white fluff behind.",Whimsicott,#547
"When attacked, it escapes by shooting cotton from its body. The cotton serves as a decoy to distract the attacker.",Cottonee,#546
"With quick movements, it chases down its foes, attacking relentlessly with its horns until it prevails.",Scolipede,#545
"Protected by a hard shell, it spins its body like a wheel and crashes furiously into its enemies.",Whirlipede,#544
"Its bite injects a potent poison, enough to paralyze large bird Pokémon that try to prey on it.",Venipede,#543
"Upon finding a small Pokémon, it weaves clothing for it from leaves, using the cutters on its arms and sticky silk.",Leavanny,#542
Forests where Swadloon live have superb foliage because the nutrients they make from fallen leaves nourish the plant life.,Swadloon,#541
Leavanny dress it in clothes they made for it when it hatched. It hides its head in its hood while it is sleeping.,Sewaddle,#540
The sound of Sawk punching boulders and trees can be heard all the way from the mountains where they train.,Sawk,#539
"When it tightens its belt, it becomes stronger. Wild Throh use vines to weave their own belts.",Throh,#538
They shoot paralyzing liquid from their head bumps. They use vibration to hurt their opponents.,Seismitoad,#537
"When they vibrate the bumps on their heads, they can make waves in water or earthquake-like vibrations on land.",Palpitoad,#536
They warn others of danger by vibrating their cheeks to create a high-pitched sound.,Tympole,#535
"It is thought that Conkeldurr taught humans how to make concrete more than 2,000 years ago.",Conkeldurr,#534
This Pokémon is so muscular and strongly built that even a group of wrestlers could not make it budge an inch.,Gurdurr,#533
It fights by swinging a piece of lumber around. It is close to evolving when it can handle the lumber without difficulty.,Timburr,#532
"It touches others with the feelers on its ears, using the sound of their heartbeats to tell how they are feeling.",Audino,#531
It can help in tunnel construction. Its drill has evolved into steel strong enough to bore through iron plates.,Excadrill,#530
It can dig through the ground at a speed of 30 mph. It could give a car running aboveground a good race.,Drilbur,#529
"It emits sound waves of various frequencies from its nose, including some powerful enough to destroy rocks.",Swoobat,#528
Its habitat is dark forests and caves. It emits ultrasonic waves from its nose to learn about its surroundings.,Woobat,#527
Compressing the energy from its internal core lets it fire off an attack capable of blowing away a mountain.,Gigalith,#526
"When it overflows with power, the orange crystal on its body glows. It looks for underground water in caves.",Boldore,#525
"Its ear is hexagonal in shape. Compressed underground, its body is as hard as steel.",Roggenrola,#524
"They have lightning-like movements. When Zebstrika run at full speed, the sound of thunder reverberates.",Zebstrika,#523
Its mane shines when it discharges electricity. They use their flashing manes to communicate with one another.,Blitzle,#522
Males swing their head plumage to threaten opponents. The females’ flying abilities surpass those of the males.,Unfezant,#521
It can return to its Trainer’s location regardless of the distance separating them.,Tranquill,#520
"Each follows its Trainer’s orders as best it can, but they sometimes fail to understand complicated commands.",Pidove,#519
The mist emanating from their foreheads is packed with the dreams of people and Pokémon.,Musharna,#518
Munna always float in the air. People whose dreams are eaten by them forget what the dreams had been about.,Munna,#517
"The tuft on its head holds water. When the level runs low, it replenishes the tuft by siphoning up water with its tail.",Simipour,#516
The water stored inside the tuft on its head is full of nutrients. Plants that receive its water grow large.,Panpour,#515
It loves sweets because they become energy for the fire burning inside its body.,Simisear,#514
"When it is angered, the temperature of its head tuft reaches 600° F. It uses its tuft to roast berries.",Pansear,#513
"Ill tempered, it fights by swinging its barbed tail around wildly. The leaf growing on its head is very bitter.",Simisage,#512
This Pokémon dwells deep in the forest. Eating a leaf from its head whisks weariness away as if by magic.,Pansage,#511
"They steal from people for fun, but their victims can’t help but forgive them. Their deceptively cute act is perfect.",Purrloin,#509
These Pokémon vanish and appear unexpectedly. Many Trainers are drawn to their beautiful form and fur.,Liepard,#510
It rescues people stranded by blizzards in the mountains. Its shaggy fur shields it from the cold.,Stoutland,#508
"It has black, cape-like fur that is very hard and decreases the amount of damage it receives.",Herdier,#507
"It faces strong opponents with great courage. But, when at a disadvantage in a fight, this intelligent Pokémon flees.",Lillipup,#506
"When they see an enemy, their tails stand high, and they spit the seeds of berries stored in their cheek pouches.",Watchog,#505
"Using food stored in cheek pouches, they can keep watch for days. They use their tails to communicate with others.",Patrat,#504
One swing of the sword incorporated in its armor can fell an opponent. A simple glare from one of them quiets everybody.,Samurott,#503
Strict training is how it learns its flowing double-scalchop technique.,Dewott,#502
"It fights using the scalchop on its stomach. In response to an attack, it retaliates immediately by slashing.",Oshawott,#501
It can throw a fire punch by setting its fists on fire with its fiery chin. It cares deeply about its friends.,Emboar,#500
"When its internal fire flares up, its movements grow sharper and faster. When in trouble, it emits smoke.",Pignite,#499
It can deftly dodge its foe’s attacks while shooting fireballs from its nose. It roasts berries before it eats them.,Tepig,#498
It can stop its opponents’ movements with just a glare. It takes in solar energy and boosts it internally.,Serperior,#497
"It moves along the ground as if sliding. Its swift movements befuddle its foes, and it then attacks with a vine whip.",Servine,#496
It is very intelligent and calm. Being exposed to lots of sunlight makes its movements swifter.,Snivy,#495
"This Pokémon brings victory. It is said that Trainers with Victini always win, regardless of the type of encounter.",Victini,#494
"It is described in mythology as the Pokémon that shaped the universe with its 1,000 arms.",Arceus,#493
It lives in flower patches and avoids detection by curling up to look like a flowering plant.,Shaymin,#492
It can lull people to sleep and make them dream. It is active during nights of the new moon.,Darkrai,#491
"Born on a cold seafloor, it will swim great distances to return to its birthplace.",Manaphy,#490
A Pokémon that lives in warm seas. It inflates the flotation sac on its head to drift and search for food.,Phione,#489
Shiny particles are released from its wings like a veil. It is said to represent the crescent moon.,Cresselia,#488
A Pokémon that is said to live in a world on the reverse side of ours. It appears in an ancient cemetery.,Giratina,#487
There is an enduring legend that states this Pokémon towed continents with ropes.,Regigigas,#486
It dwells in volcanic caves. It digs in with its cross-shaped feet to crawl on ceilings and walls.,Heatran,#485
It has the ability to distort space. It is described as a deity in Sinnoh-region mythology.,Palkia,#484
It has the power to control time. It appears in Sinnoh-region myths as an ancient deity.,Dialga,#483
Known as “The Being of Willpower.” It sleeps at the bottom of a lake to keep the world in balance.,Azelf,#482
"Known as “The Being of Emotion.” It taught humans the nobility of sorrow, pain, and joy.",Mesprit,#481
Known as “The Being of Knowledge.” It is said that it can wipe out the memory of those who see its eyes.,Uxie,#480
Its body is composed of plasma. It is known to infiltrate electronic devices and wreak havoc.,Rotom,#479
It freezes foes with an icy breath nearly -60 degrees F. What seems to be its body is actually hollow.,Froslass,#478
It exudes strong magnetism from all over. It controls three small units called Mini-Noses.,Probopass,#476
The antenna on its head captures radio waves from the world of spirits that command it to take people there.,Dusknoir,#477
"A master of courtesy and swordsmanship, it fights using extending swords on its elbows.",Gallade,#475
"Additional software was installed to make it a better Pokémon. It began acting oddly, however.",Porygon-Z,#474
Its impressive tusks are made of ice. The population thinned when it turned warm after the ice age.,Mamoswine,#473
"If it succeeds in catching even a faint breeze properly, it can circle the globe without flapping once.",Gliscor,#472
"As a protective technique, it can completely freeze its fur to make its hairs stand like needles.",Glaceon,#471
"Just like a plant, it uses photosynthesis. As a result, it is always enveloped in clear air.",Leafeon,#470
"By churning its wings, it creates shock waves that inflict critical internal injuries to foes.",Yanmega,#469
It will never appear where there is strife. Its sightings have become rare recently.,Togekiss,#468
"It blasts fireballs of over 3,600 degrees F from the ends of its arms. It lives in volcanic craters.",Magmortar,#467
"It pushes the tips of its two tails against the foe, then lets loose with over 20,000 volts of power.",Electivire,#466
It ensnares prey by extending arms made of vines. Losing arms to predators does not trouble it.,Tangrowth,#465
It puts rocks in holes in its palms and uses its muscles to shoot them. GEODUDE are shot at rare times.,Rhyperior,#464
It wraps things with its extensible tongue. Getting too close to it will leave you soaked with drool.,Lickilicky,#463
It evolved from exposure to a special magnetic field. Three units generate magnetism.,Magnezone,#462
"They live in cold regions, forming groups of four or five that hunt prey with impressive coordination.",Weavile,#461
It whips up blizzards in mountains that are always buried in snow. It is the abominable snowman.,Abomasnow,#460
"It lives on snowy mountains. Having had little contact with humans, it is boldly inquisitive.",Snover,#459
A friendly Pokémon that captures the subtle flows of seawater using its two antennae.,Mantyke,#458
It lives on the deep-sea floor. It attracts prey by flashing the patterns on its four tail fins.,Lumineon,#457
"After long exposure to sunlight, the patterns on its tail fins shine vividly when darkness arrives.",Finneon,#456
"It attracts prey with its sweet-smelling saliva, then chomps down. It takes a whole day to eat prey.",Carnivine,#455
Its knuckle claws secrete a toxin so vile that even a scratch could prove fatal.,Toxicroak,#454
Its cheeks hold poison sacs. It tries to catch foes off guard to jab them with toxic fingers.,Croagunk,#453
It has the power in its clawed arms to make scrap of a car. The tips of its claws release poison.,Drapion,#452
It grips prey with its tail claws and injects poison. It tenaciously hangs on until the poison takes.,Skorupi,#451
It blasts internally stored sand from ports on its body to create a towering twister for attack.,Hippowdon,#450
"It lives in arid places. Instead of perspiration, it expels grainy sand from its body.",Hippopotas,#449
It has the ability to sense the auras of all things. It understands human speech.,Lucario,#448
The aura that emanates from its body intensifies to alert others if it is afraid or sad.,Riolu,#447
"It wolfs down its weight in food once a day, swallowing food whole with almost no chewing.",Munchlax,#446
"When it folds up its body and extends its wings, it looks like a jet plane. It flies at sonic speed.",Garchomp,#445
There is a long-held belief that medicine made from its scales will heal even incurable illnesses.,Gabite,#444
"It nests in small, horizontal holes in cave walls. It pounces to catch prey that stray too close.",Gible,#443
A Pokémon that was formed by 108 spirits. It is bound to a fissure in an odd keystone.,Spiritomb,#442
"It can learn and speak human words. If they gather, they all learn the same saying.",Chatot,#441
It loves round white things. It carries an egg-shaped rock in imitation of CHANSEY.,Happiny,#440
"It habitually mimics foes. Once mimicked, the foe cannot take its eyes off this Pokémon.",Mime Jr.,#439
It looks as if it is always crying. It is actually adjusting its body’s fluid levels by eliminating excess.,Bonsly,#438
"One caused a news sensation when it was dug up at a construction site after a 2,000-year sleep.",Bronzong,#437
Implements shaped like it were discovered in ancient tombs. It is unknown if they are related.,Bronzor,#436
It sprays a vile-smelling fluid from the tip of its tail to attack. Its range is over 160 feet.,Skuntank,#435
It protects itself by spraying a noxious fluid from its rear. The stench lingers for 24 hours.,Stunky,#434
It emits cries by agitating an orb at the back of its throat. It moves with flouncing hops.,Chingling,#433
It is a brazen brute that barges its way into another Pokémon’s nest and claims it as its own.,Purugly,#432
It claws if displeased and purrs when affectionate. Its fickleness is very popular among some.,Glameow,#431
"Becoming active at night, it is known to swarm with numerous MURKROW in tow.",Honchkrow,#430
Its cries sound like incantations. Those hearing it are tormented by headaches and hallucinations.,Mismagius,#429
An extremely cautious Pokémon. It cloaks its body with its fluffy ear fur when it senses danger.,Lopunny,#428
It slams foes by sharply uncoiling its rolled ears. It stings enough to make a grown-up cry in pain.,Buneary,#427
"It’s drowzy in daytime, but flies off in the evening in big groups. No one knows where they go.",Drifblim,#426
"A Pokémon formed by the spirits of people and Pokémon. It loves damp, humid seasons.",Drifloon,#425
"To eat, it deftly shucks nuts with its two tails. It rarely uses its arms now.",Ambipom,#424
"It has a pliable body without any bones. If any part of its body is torn off, it grows right back.",Gastrodon,#423
"Its colors and shapes differ from region to region. In the Sinnoh region, two types are confirmed.",Shellos,#422
It blooms during times of strong sunlight. It tries to make up for everything it endured as a bud.,Cherrim,#421
"The small ball holds the nutrients needed for evolution. Apparently, it is very sweet and tasty.",Cherubi,#420
It floats using its well-developed flotation sac. It assists in the rescues of drowning people.,Floatzel,#419
It has a flotation sac that is like an inflatable collar. It floats on water with its head out.,Buizel,#418
It makes fur balls that crackle with static electricity. It stores them with berries in tree holes.,Pachirisu,#417
Its abdomen is a honeycomb for grubs. It raises its grubs on honey collected by COMBEE.,Vespiquen,#416
A Pokémon formed by three others. It busily carries sweet floral honey to VESPIQUEN.,Combee,#415
It loves the honey of flowers and steals honey collected by COMBEE.,Mothim,#414
"When BURMY evolved, its cloak became a part of this Pokémon’s body. The cloak is never shed.",Wormadam,#413
"To shelter itself from cold, wintry winds, it covers itself with a cloak made of twigs and leaves.",Burmy,#412
Any frontal attack is repulsed. It is a docile Pokémon that feeds on grass and berries.,Bastiodon,#411
A Pokémon that lived in jungles around 100 million years ago. Its facial hide is extremely hard.,Shieldon,#410
Its powerful head butt has enough power to shatter even the most durable things upon impact.,Rampardos,#409
It lived in jungles around 100 million years ago. Its skull is as hard as iron.,Cranidos,#408
"It attracts prey with a sweet aroma, then downs it with thorny whips hidden in its arms.",Roserade,#407
"Over the winter, it closes its bud and endures the cold. In spring, the bud opens and releases pollen.",Budew,#406
It has eyes that can see through anything. It spots and captures prey hiding behind objects.,Luxray,#405
Its claws loose electricity with enough amperage to cause fainting. They live in small groups.,Luxio,#404
All of its fur dazzles if danger is sensed. It flees while the foe is momentarily blinded.,Shinx,#403
It crosses its knifelike arms in front of its chest when it cries. It can compose melodies ad lib.,Kricketune,#402
